"ALL GROUPS","جميع المجموعات"
"Customer Group","مجموعات العملاء"
"Minimum Qty","الحد الأدنى من الكمية"
"Add Minimum Qty","اضف حد أدنى للكمية"
"We can't rebuild the index for an undefined product.","لا يمكن إعادة إنشاء الفهرس لمنتج غير معروف."
"Could not rebuild index for empty products array","لا يمكن إعادة إنشاء الفهرس لمجموعة منتجات فارغة"
"The stock item for Product is not valid.","The stock item for Product is not valid."
"This product is out of stock.","هذا المنتج غير متوفر في المخزن."
"Some of the products are out of stock.","بعض المنتجات غير متوفرة بالمخزن."
"The stock item for Product in option is not valid.","عنصر التخزين لهذا المنتج في الخيار غير صحيح."
"Undefined product type","نوع المنتج غير معروف"
"%1 is not a correct comparison method.","%1 ليس أسلوب مقارنة صحيحة."
"No Backorders","لا توجد طلبات لمنتجات غير متوفرة"
"Allow Qty Below 0","السماح بالكمية 0"
"Allow Qty Below 0 and Notify Customer","السماح بكمية تحت ال 0 و أعلام العميل"
"In Stock","متوفر في المخزن"
"Out of Stock","غير متوفر بالمخزن"
"Unable to save Stock Item","Unable to save Stock Item"
"Stock Item with id ""%1"" does not exist.","Stock Item with id ""%1"" does not exist."
"Unable to remove Stock Item with id ""%1""","Unable to remove Stock Item with id ""%1"""
"Unable to save Stock","Unable to save Stock"
"Stock with id ""%1"" does not exist.","Stock with id ""%1"" does not exist."
"Unable to remove Stock with id ""%1""","غير قادر على إزالة المخزون للمعرف ""%1"""
"Unable to save Stock Status","Unable to save Stock Status"
"Unable to remove Stock Status for product %1","غير قادر على إزالة ""حالة المخزون"" للمنتج %1"
"Invalid stock id: %1. Only default stock with id %2 allowed","Invalid stock id: %1. Only default stock with id %2 allowed"
"Invalid stock item id: %1. Should be null or numeric value greater than 0","Invalid stock item id: %1. Should be null or numeric value greater than 0"
"Invalid stock item id: %1. Assigned stock item id is %2","Invalid stock item id: %1. Assigned stock item id is %2"
"Not all of your products are available in the requested quantity.","Not all of your products are available in the requested quantity."
"Product with SKU ""%1"" does not exist","Product with SKU ""%1"" does not exist"
"The fewest you may purchase is %1.","أقل عدد يمكنك شراؤه هو %1."
"Please correct the quantity for some products.","الرجاء تصحيح الكمية لبعض المنتجات."
"The most you may purchase is %1.","The most you may purchase is %1."
"We don't have as many ""%1"" as you requested.","We don't have as many ""%1"" as you requested."
"We don't have as many ""%1"" as you requested, but we'll back order the remaining %2.","ليس لدينا العديد من ""%1"" كما طلبت، ولكن سوف نعيد أمر %2 المتبقية."
"We don't have ""%1"" in the requested quantity, so we'll back order the remaining %2.","ليس لدينا ""%1"" بالكمية المطلوبة، حيث أننا سوف نعيد أمر %2 المتبقية."
"You can buy %1 only in quantities of %2 at a time.","يمكنك شراء %1 بكميات فقط من %2 في وقت واحد."
"You can buy this product only in quantities of %1 at a time.","يمكنك الشراء من هذا المنتج فقط بكميات من %1 في وقت واحد."
"Decimal qty increments is not allowed.","Decimal qty increments is not allowed."
"Stock Status","حالة المخزن"
"Quantity","الكمية"
"Advanced Inventory","المخزون المتقدم"
"%1 is available to buy in increments of %2","%1 متاحة للشراء بزيادة بالمقدار %2"
"Only %1 left","متوفر %1 فقط"
"Product availability","توافر المنتج"
"Product Name","اسم المنتج"
"Qty","الكميّة"
"Inventory Section","قسم المخزن"
"Inventory","المخزون"
"Stock Options","خيارات المخزون"
"Decrease Stock When Order is Placed","ازل من المخزون عند استلام الطلب الجديد"
"Set Items' Status to be In Stock When Order is Cancelled","ضع العناصر في حالة مخزون عندما يتم إلغاء الطلب"
"Display Out of Stock Products","عرض المنتجات الغير متوفرة بالمخزن"
"Products will still be shown by direct product URLs.","سوف يستمر عرض المنتجات بالرابط المباشر URL للمنتج."
"Only X left Threshold","المتبقي فقط هو الحد"
"Display Products Availability in Stock on Storefront","إعرض المنتجات المتوفرة في المخزن على واجهة المتجر"
"Product Stock Options","خيارات المنتج المخزون"
"Please note that these settings apply to individual items in the cart, not to the entire cart.","الرجاء ملاحظة أن سيتم تطبيق هذه الإعدادات على العناصر الفردية في السلة، لا محتويات السلة كاملة."
"Manage Stock","إدارة المخزون"
"Backorders","طلبات لمنتجات غير متوفرة"
"Maximum Qty Allowed in Shopping Cart","الكمية القصوى المسموح بها في سلة التسوق"
"Out-of-Stock Threshold","حدود انتهاء المخزون"
"Minimum Qty Allowed in Shopping Cart","الكمية الدنيا المسموح بها في سلة التسوق"
"Notify for Quantity Below","اخطار لكمية ادناه"
"Automatically Return Credit Memo Item to Stock","إعادة مذكرة بطاقة الائتمان تلقائياً المخزن"
"Enable Qty Increments","تمكين زيادة الكميات"
"Qty Increments","زيادة الكميات"
"Stock","المخزون"
"Index stock","مؤشر المخزون"
"Use Config Settings","استخدام اعداد الاعدادات"
"Qty Uses Decimals","كمية تستخدم ارقام عشرية"
"Allow Multiple Boxes for Shipping","السماح بصناديق متعددة للشحن"
"Display products availability in stock on Storefront.","Display products availability in stock on Storefront."
"Use Deferred Stock Update","Use Deferred Stock Update"
"Changing can take some time due to processing whole catalog.","Changing can take some time due to processing whole catalog."
"The Product stock item is invalid. Verify the stock item and try again.","The Product stock item is invalid. Verify the stock item and try again."
"The stock item was unable to be saved. Please try again.","The stock item was unable to be saved. Please try again."
"The stock item with the ""%1"" ID wasn't found. Verify the ID and try again.","The stock item with the ""%1"" ID wasn't found. Verify the ID and try again."
"The stock was unable to be saved. Please try again.","The stock was unable to be saved. Please try again."
"The stock with the ""%1"" ID wasn't found. Verify the ID and try again.","The stock with the ""%1"" ID wasn't found. Verify the ID and try again."
"The stock status was unable to be saved. Please try again.","The stock status was unable to be saved. Please try again."
"The ""%1"" value is invalid for stock ID. Enter stock with a default value of %2 to try again.","The ""%1"" value is invalid for stock ID. Enter stock with a default value of %2 to try again."
"The ""%1"" value is invalid for stock item ID. Enter either zero or a number than zero to try again.","The ""%1"" value is invalid for stock item ID. Enter either zero or a number than zero to try again."
"The ""%1"" value is invalid for stock item ID. Use the stock item ID's assigned ""%2"" value and try again.","The ""%1"" value is invalid for stock item ID. Use the stock item ID's assigned ""%2"" value and try again."
"The Product with the ""%1"" SKU doesn't exist.","The Product with the ""%1"" SKU doesn't exist."
"The requested qty is not available","The requested qty is not available"
"Quantity increments can't use decimals. Enter a new increment and try again.","Quantity increments can't use decimals. Enter a new increment and try again."
