"Unable to save address. Please check input data.","Unable to save address. Please check input data."
"Cart %1 doesn't contain products","Cart %1 doesn't contain products"
"Could not apply coupon code","Could not apply coupon code"
"Coupon code is not valid","Coupon code is not valid"
"Could not delete coupon code","Could not delete coupon code"
"Cannot assign customer to the given cart. You don't have permission for this operation.","Cannot assign customer to the given cart. You don't have permission for this operation."
"Shipping address is not set","Shipping address is not set"
"The requested Payment Method is not available.","Il metodo di pagamento richiesto non è disponibile."
"We found an invalid request for adding product to quote.","Richiesta non valida per aggiungere il prodotto al preventivo."
"Product that you are trying to add is not available.","Prodotto che si sta tentando di aggiungere non è disponibile."
"This is the wrong quote item id to update configuration.","Questo è un id elemento del preventivo errato per aggiornare la configurazione."
"This shipping method is not available. To use this shipping method, please contact us.","Questo metodo di spedizione non è disponibile. Per utilizzare questo metodo di spedizione, vi preghiamo di contattarci."
"The address model is not defined.","Il modello di indirizzo non è definito."
"The address total model should be extended from
                    \Magento\Quote\Model\Quote\Address\Total\AbstractTotal.","Il modello di indirizzo totale dovrebbe essere esteso da \Magento\Quote\Model\Quote\Address\Total\AbstractTotal."
"Grand Total","Totale complessivo"
"Shipping & Handling (%1)","Spedizione e gestione (%1)"
"Shipping & Handling","Spedizione e gestione"
"Shipping","Spedizione"
"Subtotal","Subtotale"
"We found an invalid item option format.","Abbiamo trovato un formato dell'opzione dell'elemento non valido."
"An item option with code %1 already exists.","Un'opzione dell'articolo con il codice %1 esiste già."
"Item qty declaration error","Errore di dichiarazione della quantità dell'elemento"
"Some of the products below do not have all the required options.","Alcuni dei seguenti prodotti non hanno tutte le opzioni necessarie."
"Something went wrong during the item options declaration.","Qualcosa è andato storto durante la dichiarazione delle opzioni elemento."
"We found an item options declaration error.","Abbiamo trovato un errore di dichiarazione nelle opzioni dell'elemento."
"Some of the selected options are not currently available.","Alcune delle opzioni selezionate non sono al momento disponibili."
"Selected option(s) or their combination is not currently available.","Le opzioni selezionate o delle combinazioni di esse non sono attualmente disponibili."
"Some item options or their combination are not currently available.","Alcune opzioni dell'elemento o una combinazione di esse non sono attualmente disponibili."
"Cart %1 does not contain item %2","Cart %1 does not contain item %2"
"Could not save quote","Could not save quote"
"Cart %1 doesn't contain item  %2","Cart %1 doesn't contain item  %2"
"Could not remove item from quote","Could not remove item from quote"
"The qty value is required to update quote item.","Il valore della quantità è obbligatoria per aggiornare l'elemento del preventivo."
"Minimum order amount is %1","L'importo minimo d'ordine è %1"
"Invalid customer id %1","Id cliente %1 non valido "
"Invalid address id %1","Id indirizzo %1 non valido"
"Invalid customer address id %1","Id indirizzo cliente %1 non valido"
"Cannot create quote","Cannot create quote"
"Cannot assign customer to the given cart. The cart belongs to different store.","Cannot assign customer to the given cart. The cart belongs to different store."
"Cannot assign customer to the given cart. The cart is not anonymous.","Cannot assign customer to the given cart. The cart is not anonymous."
"Cannot assign customer to the given cart. Customer already has active cart.","Cannot assign customer to the given cart. Customer already has active cart."
"An error occurred on the server. Please try to place the order again.","An error occurred on the server. Please try to place the order again."
"Invalid state change requested","Richiesto un cambio di stato non valido"
"Only 1 shipping assignment can be set","Può essere impostato una sola assegnazione di spedizione"
"This item price or quantity is not valid for checkout.","Questo prezzo o quantità dell'elemento non è valida per il checkout."
"Please check the shipping address information. %1","Please check the shipping address information. %1"
"Some addresses cannot be used due to country-specific configurations.","Some addresses cannot be used due to country-specific configurations."
"Please specify a shipping method.","Please specify a shipping method."
"Please check the billing address information. %1","Please check the billing address information. %1"
"Please select a valid payment method.","Please select a valid payment method."
"Store Credit","Credito negozio"
"Discount","Sconto"
"Tax","Tassa"
"Cart contains virtual product(s) only. Shipping address is not applicable.","Cart contains virtual product(s) only. Shipping address is not applicable."
"Shipping address not set.","Shipping address not set."
"Cannot set shipping method. %1","Cannot set shipping method. %1"
"Shipping method is not applicable for empty cart","Shipping method is not applicable for empty cart"
"Cart contains virtual product(s) only. Shipping method is not applicable.","Cart contains virtual product(s) only. Shipping method is not applicable."
"Minimum Order Amount Exceeded.","Minimum Order Amount Exceeded."
"error345","error345"
"Carts","Carrelli"
"Manage carts","Gestisci carrelli"
"Unable to save address. Please, check input data.","Unable to save address. Please, check input data."
"Cannot place order.","Cannot place order."
"Carrier with such method not found: %1, %2","Carrier with such method not found: %1, %2"
"error123","error123"
"Cart isn't assigned to correct store","Il carrello non è assegnato al negozio corretto"
"Something went wrong. Please try to place the order again.","Something went wrong. Please try to place the order again."
"Some addresses can't be used due to the configurations for specific countries.","Some addresses can't be used due to the configurations for specific countries."
"Please check the shipping address information.","Please check the shipping address information."
"The shipping method is missing. Select the shipping method and try again.","The shipping method is missing. Select the shipping method and try again."
"Please check the billing address information.","Controlla le informazioni dell'indirizzo di fatturazione."
"Enter a valid payment method and try again.","Inserisci un metodo di pagamento valido e riprova."
"Unable to place order. Please try again later.","Unable to place order. Please try again later."
"The address failed to save. Verify the address and try again.","L'indirizzo non è stato salvato. Verificare l'indirizzo e riprovare."
"The ""%1"" Cart doesn't contain products.","Il carrello ""%1"" non contiene prodotti."
"The coupon code couldn't be applied. Verify the coupon code and try again.","The coupon code couldn't be applied. Verify the coupon code and try again."
"The coupon code isn't valid. Verify the code and try again.","The coupon code isn't valid. Verify the code and try again."
"The coupon code couldn't be deleted. Verify the coupon code and try again.","The coupon code couldn't be deleted. Verify the coupon code and try again."
"You don't have the correct permissions to assign the customer to the cart.","You don't have the correct permissions to assign the customer to the cart."
"The shipping address is missing. Set the address and try again.","The shipping address is missing. Set the address and try again."
"The %1 Cart doesn't contain the %2 item.","Il carrello %1 non contiene l'articolo %2."
"The quote couldn't be saved.","The quote couldn't be saved."
"The item couldn't be removed from the quote.","The item couldn't be removed from the quote."
"The quote can't be created.","The quote can't be created."
"The customer can't be assigned to the cart. The cart belongs to a different store.","The customer can't be assigned to the cart. The cart belongs to a different store."
"The customer can't be assigned to the cart because the cart isn't anonymous.","The customer can't be assigned to the cart because the cart isn't anonymous."
"The customer can't be assigned to the cart because the customer already has an active cart.","The customer can't be assigned to the cart because the customer already has an active cart."
"A server error stopped your order from being placed. Please try to place your order again.","A server error stopped your order from being placed. Please try to place your order again."
"The Cart includes virtual product(s) only, so a shipping address is not used.","The Cart includes virtual product(s) only, so a shipping address is not used."
"The shipping method can't be set. %1","The shipping method can't be set. %1"
"The shipping method can't be set for an empty cart. Add an item to cart and try again.","The shipping method can't be set for an empty cart. Add an item to cart and try again."
"Current customer does not have an active cart.","Current customer does not have an active cart."
