"Unable to save address. Please check input data.","Kan het adres niet opslaan. Controleer de ingevoerde gegevens."
"Cart %1 doesn't contain products","Winkelwagen %1 bevat geen producten"
"Could not apply coupon code","Kortingscode kan niet worden toegepast"
"Coupon code is not valid","Couponcode is niet geldig"
"Could not delete coupon code","couponcode kan niet verwijderd worden "
"Cannot assign customer to the given cart. You don't have permission for this operation.","Kan klant niet aan de opgegeven winkelwagen koppelen. U heeft geen bevoegdheid om dit uit te voeren."
"Shipping address is not set","Verzendadres is niet ingesteld"
"The requested Payment Method is not available.","De gevraagde betaalmethode is niet beschikbaar."
"We found an invalid request for adding product to quote.","We vonden een ongeldige aanvraag om het product toe te voegen aan de quote."
"Product that you are trying to add is not available.","Product dat u probeert toe te voegen is niet beschikbaar."
"This is the wrong quote item id to update configuration.","Dit is het verkeerd quote item id om de configuratie bij te werken."
"This shipping method is not available. To use this shipping method, please contact us.","Deze verzendmethode is niet beschikbaar. Als u wilt deze verzendmethode gebruiken, neem contact met ons op."
"The address model is not defined.","De adres-model is niet gedefinieerd."
"The address total model should be extended from
                    \Magento\Quote\Model\Quote\Address\Total\AbstractTotal.","Het adres totaal model zal moeten worden uitgebreid van \Magento\Quote\Model\Quote\Address\Total\AbstractTotal."
"Grand Total","Eindtotaal"
"Shipping & Handling (%1)","Verzending & verwerking (%1)"
"Shipping & Handling","Verzending en verwerking"
"Shipping","Aflevering"
"Subtotal","Subtotaal"
"We found an invalid item option format.","We vonden een ongeldig optie formaat."
"An item option with code %1 already exists.","Een product optie met code %1 bestaad reeds."
"Item qty declaration error","Artikel-aantal declaratiefout"
"Some of the products below do not have all the required options.","Sommige van de producten hieronder hebben niet alle verplicht opties."
"Something went wrong during the item options declaration.","Er ging iets mis tijdens het opmaken van de opties van het item."
"We found an item options declaration error.","We vonden een productopties declaratie fout."
"Some of the selected options are not currently available.","Sommige van de geselecteerde opties zijn op dit moment niet beschikbaar."
"Selected option(s) or their combination is not currently available.","De geselecteerde optie(s) of de combinatie hiervan is op dit moment niet beschikbaar."
"Some item options or their combination are not currently available.","Sommige item opties of de combinatie hiervan zijn op dit moment niet beschikbaar."
"Cart %1 does not contain item %2","Winkelwagen %1 bevat product %2 niet"
"Could not save quote","Quote kon niet worden opgeslagen"
"Cart %1 doesn't contain item  %2","Winkelwagen %1 bevat geen artikel %2"
"Could not remove item from quote","Kan item niet verwijderen uit quote"
"The qty value is required to update quote item.","De qty waarde is verplicht om het quote item bij te werken."
"Minimum order amount is %1","Minimaal bestelaantal is %1"
"Invalid customer id %1","Ongeldig klant id %1"
"Invalid address id %1","Ongeldig adres id %1"
"Invalid customer address id %1","Ongeldig klant-adres id %1"
"Cannot create quote","Quote kon niet worden aangemaakt"
"Cannot assign customer to the given cart. The cart belongs to different store.","De klant kan niet toegewezen worden aan deze winkelwagen. De winkelwagen behoort toe aan een andere winkel."
"Cannot assign customer to the given cart. The cart is not anonymous.","De klant kan niet toegewezen worden aan deze winkelwagen. De winkelwagen is niet anoniem."
"Cannot assign customer to the given cart. Customer already has active cart.","De klant kan niet toegewezen worden aan deze winkelwagen. De klant heeft al een actieve winkelwagen."
"An error occurred on the server. Please try to place the order again.","Er is een fout opgetreden op de server. Probeer de bestelling opnieuw te plaatsen."
"Invalid state change requested","Ongeldige statuswijziging gevraagd"
"Only 1 shipping assignment can be set","Slechts 1 verzending toewijzing kan worden ingesteld"
"This item price or quantity is not valid for checkout.","Deze productprijs of aantal is niet geldig voor afhandeling."
"Please check the shipping address information. %1","Gelieve de verzendgegevens van dit adres te controleren. %1"
"Some addresses cannot be used due to country-specific configurations.","Sommige adressen kunnen niet worden gebruikt als gevolg van land-specifieke configuraties."
"Please specify a shipping method.","Geef een verzendmethode op."
"Please check the billing address information. %1","Gelieve de verzendgegevens van dit adres te controleren. %1"
"Please select a valid payment method.","Selecteer een geldige betaalmethode."
"Store Credit","Winkeltegoed"
"Discount","Korting"
"Tax","BTW"
"Cart contains virtual product(s) only. Shipping address is not applicable.","Winkelwagen bevat alleen virtuele producten. Verzendadres is niet van toepassing."
"Shipping address not set.","Verzendadres niet ingesteld."
"Cannot set shipping method. %1","Kan de verzendmethode niet instellen.%1"
"Shipping method is not applicable for empty cart","Verzendmethode is niet van toepassing voor een lege winkelwagen"
"Cart contains virtual product(s) only. Shipping method is not applicable.","Winkelwagen bevat alleen virtuele product(en). Verzendmethode is hiervoor niet van toepassing."
"Minimum Order Amount Exceeded.","Minimum bestelbedrag overschreden."
"error345","error345"
"Carts","Winkelwagens"
"Manage carts","Winkelwagens beheren"
"Unable to save address. Please, check input data.","Kan adres niet opslaan. Controleer de ingevoerde gegevens."
"Cannot place order.","Kan geen bestelling plaatsen."
"Carrier with such method not found: %1, %2","Vervoerder met dergelijke methode niet gevonden: %1, %2"
"error123","error123"
"Cart isn't assigned to correct store","De winkelwagen is niet toegewezen aan de juist winkel"
"Something went wrong. Please try to place the order again.","Er is een fout opgetreden. Probeer de order nogmaals te plaatsen."
"Some addresses can't be used due to the configurations for specific countries.","Sommige adressen kunnen niet worden gebruikt vanwege de configuraties voor specifieke landen."
"Please check the shipping address information.","Gelieve de verzendgegevens van dit adres te controleren."
"The shipping method is missing. Select the shipping method and try again.","De verzendmethode ontbreekt. Selecteer de verzendmethode en probeer het opnieuw."
"Please check the billing address information.","Gelieve het factuuradres te controleren."
"Enter a valid payment method and try again.","Voer een geldige betaalmethode in en probeer opnieuw."
"Unable to place order. Please try again later.","Kan bestelling niet plaatsen. Probeer het later opnieuw."
"The address failed to save. Verify the address and try again.","Het opslaan van het adres is mislukt. Controleer het adres en probeer het opnieuw."
"The ""%1"" Cart doesn't contain products.","Winkelwagen ""%1"" bevat geen producten."
"The coupon code couldn't be applied. Verify the coupon code and try again.","De couponcode kon niet worden toegepast. Controleer de couponcode en probeer het opnieuw."
"The coupon code isn't valid. Verify the code and try again.","De kortingscode is niet geldig. Controleer de code en probeer het opnieuw."
"The coupon code couldn't be deleted. Verify the coupon code and try again.","De couponcode kon niet worden verwijderd. Controleer de couponcode en probeer het opnieuw."
"You don't have the correct permissions to assign the customer to the cart.","U heeft niet de juiste machtigingen om de klant aan de winkelwagen toe te wijzen."
"The shipping address is missing. Set the address and try again.","Het verzendadres ontbreekt. Stel het adres in en probeer het opnieuw."
"The %1 Cart doesn't contain the %2 item.","Winkelwagen ""%1"" bevat geen product ""%2""."
"The quote couldn't be saved.","De offerte kan niet worden opgeslagen."
"The item couldn't be removed from the quote.","Het product kon niet uit de offerte worden verwijderd."
"The quote can't be created.","De offerte kan niet worden gemaakt."
"The customer can't be assigned to the cart. The cart belongs to a different store.","De klant worden niet toegewezen aan de winkelwagen. De winkelwagen behoort tot een andere winkel."
"The customer can't be assigned to the cart because the cart isn't anonymous.","De klant kan niet worden toegewezen aan de winkelwagen, omdat de winkelwagen niet anoniem is."
"The customer can't be assigned to the cart because the customer already has an active cart.","De klant kon niet toegewezen worden aan de winkelwagen, omdat de klant al een actieve winkelwagen heeft."
"A server error stopped your order from being placed. Please try to place your order again.","Een serverfout heeft er voor gezorgd dat de bestelling niet geplaatst kan worden. Probeer uw bestelling nogmaals te plaatsen."
"The Cart includes virtual product(s) only, so a shipping address is not used.","De winkelwagen bevat alleen virtuele producten, waardoor een verzendadres niet nodig is."
"The shipping method can't be set. %1","De verzendmethode kan niet ingesteld worden. %1"
"The shipping method can't be set for an empty cart. Add an item to cart and try again.","De verzendmethode kan niet worden ingesteld voor een lege winkelwagen. Voeg een item toe aan de winkelwagen en probeer het opnieuw."
"Current customer does not have an active cart.","Huidige klant heeft geen actieve winkelwagen."
