"Unable to save address. Please check input data.","Não é possível salvar o endereço. Por favor, verifique os dados de entrada."
"Cart %1 doesn't contain products","O carrinho %1 não contém produtos"
"Could not apply coupon code","Não foi possivel aplicar o código do cupom"
"Coupon code is not valid","O código do cupom não é válido"
"Could not delete coupon code","Não foi possível excluir o código do cupom"
"Cannot assign customer to the given cart. You don't have permission for this operation.","Não é possível atribuir o carrinho de determinado cliente. Você não tem permissão para esta operação."
"Shipping address is not set","Endereço de envio não está definido"
"The requested Payment Method is not available.","O método de pagamento solicitado não está disponível."
"We found an invalid request for adding product to quote.","Encontramos uma solicitação inválida para adicionar o produto para cotação."
"Product that you are trying to add is not available.","O produto que você está tentando adicionar não está disponível."
"This is the wrong quote item id to update configuration.","Este é o id de item de cotação errado para atualizar a configuração."
"This shipping method is not available. To use this shipping method, please contact us.","Este método de envio não está disponível. Para usar este método de envio, entre em contato conosco."
"The address model is not defined.","O modelo de endereço não está definido."
"The address total model should be extended from
                    \Magento\Quote\Model\Quote\Address\Total\AbstractTotal.","O modelo de endereço completo deve estender de
                    \Magento\Quote\Model\Quote\Address\Total\AbstractTotal."
"Grand Total","Total geral"
"Shipping & Handling (%1)","Envio e Manuseio (%1)"
"Shipping & Handling","Envio e Manuseio"
"Shipping","Frete"
"Subtotal","Sub-total"
"We found an invalid item option format.","Encontramos um formato de opção de item inválido."
"An item option with code %1 already exists.","Uma opção de item com o código %1 já existe."
"Item qty declaration error","Erro de declaração de qtd de item"
"Some of the products below do not have all the required options.","Alguns dos produtos abaixo não têm todas as opções necessárias."
"Something went wrong during the item options declaration.","Houve algum erro durante a declaração das opções do item."
"We found an item options declaration error.","Encontrámos um erro de declaração das opções do item."
"Some of the selected options are not currently available.","Algumas das opções selecionadas não estão disponíveis de momento."
"Selected option(s) or their combination is not currently available.","Opção (ões) selecionada ou sua combinação não está atualmente disponível."
"Some item options or their combination are not currently available.","Algumas opções de itens ou a sua combinação não estão disponíveis de momento."
"Cart %1 does not contain item %2","O carrinho %1 não contém o item %2"
"Could not save quote","Não foi possível gravar o orçamento"
"Cart %1 doesn't contain item  %2","O carrinho %1 não contém o tem %2"
"Could not remove item from quote","Não foi possível remover um item do orçamento"
"The qty value is required to update quote item.","O valor da qtd é necessário para atualizar o item do orçamento."
"Minimum order amount is %1","O valor mínimo do pedido é %1"
"Invalid customer id %1","%1 de identificação de cliente inválido"
"Invalid address id %1","Id do endereço inválido %1"
"Invalid customer address id %1","Id do endereço inválido %1"
"Cannot create quote","Não foi possível criar o orçamento"
"Cannot assign customer to the given cart. The cart belongs to different store.","Não é possível atribuir o carrinho ao cliente. O carrinho pertence a outra loja."
"Cannot assign customer to the given cart. The cart is not anonymous.","Não foi possível associar o cliente ao carrinho. O carrinho não é anônimo."
"Cannot assign customer to the given cart. Customer already has active cart.","Não foi possível associar o cliente ao carrinho especificado. O cliente já tem um carrinho ativo."
"An error occurred on the server. Please try to place the order again.","Ocorreu um erro no servidor. Por favor, tente fazer o pedido novamente."
"Invalid state change requested","Solicitação de mudança de estado inválida"
"Only 1 shipping assignment can be set","Apenas 1 transportadora pode ser definida"
"This item price or quantity is not valid for checkout.","Este preço do item ou quantidade não é válido para efetuar o checkout."
"Please check the shipping address information. %1","Por favor verifique as informações de envio. %1"
"Some addresses cannot be used due to country-specific configurations.","Alguns endereços não podem ser utilizados devido a configurações específicas do país."
"Please specify a shipping method.","Por favor, especifique um método de envio."
"Please check the billing address information. %1","Por favor verifique as informações do endereço de envio. %1"
"Please select a valid payment method.","Por favor selecione um método de pagamento válido."
"Store Credit","Crédito na loja"
"Discount","Desconto"
"Tax","Taxa"
"Cart contains virtual product(s) only. Shipping address is not applicable.","O carrinho contem somente produtos virtuais. Endereço de entrega não se aplica."
"Shipping address not set.","Endereço de envio não está definido."
"Cannot set shipping method. %1","Não foi possível definir o método de envio. %1"
"Shipping method is not applicable for empty cart","Método de envio não aplicável para Carrinho de Compras vazio"
"Cart contains virtual product(s) only. Shipping method is not applicable.","O carrinho contem somente produtos digitais. Endereço de entrega não se aplica."
"Minimum Order Amount Exceeded.","Quantidade mínima do pedido excedida."
"error345","error345"
"Carts","Carrinhos"
"Manage carts","Gerenciar carrinhos"
"Unable to save address. Please, check input data.","Não é possível salvar o endereço. Por favor, verifique os dados de entrada."
"Cannot place order.","Não foi possível fechar o pedido."
"Carrier with such method not found: %1, %2","Transportador com esse método não encontrado: %1, %2"
"error123","erro123"
"Cart isn't assigned to correct store","Cart isn't assigned to correct store"
"Something went wrong. Please try to place the order again.","Something went wrong. Please try to place the order again."
"Some addresses can't be used due to the configurations for specific countries.","Some addresses can't be used due to the configurations for specific countries."
"Please check the shipping address information.","Please check the shipping address information."
"The shipping method is missing. Select the shipping method and try again.","The shipping method is missing. Select the shipping method and try again."
"Please check the billing address information.","Please check the billing address information."
"Enter a valid payment method and try again.","Enter a valid payment method and try again."
"Unable to place order. Please try again later.","Não é possível fazer o pedido. Por favor, tente novamente mais tarde."
"The address failed to save. Verify the address and try again.","The address failed to save. Verify the address and try again."
"The ""%1"" Cart doesn't contain products.","The ""%1"" Cart doesn't contain products."
"The coupon code couldn't be applied. Verify the coupon code and try again.","The coupon code couldn't be applied. Verify the coupon code and try again."
"The coupon code isn't valid. Verify the code and try again.","The coupon code isn't valid. Verify the code and try again."
"The coupon code couldn't be deleted. Verify the coupon code and try again.","The coupon code couldn't be deleted. Verify the coupon code and try again."
"You don't have the correct permissions to assign the customer to the cart.","You don't have the correct permissions to assign the customer to the cart."
"The shipping address is missing. Set the address and try again.","The shipping address is missing. Set the address and try again."
"The %1 Cart doesn't contain the %2 item.","The %1 Cart doesn't contain the %2 item."
"The quote couldn't be saved.","The quote couldn't be saved."
"The item couldn't be removed from the quote.","The item couldn't be removed from the quote."
"The quote can't be created.","The quote can't be created."
"The customer can't be assigned to the cart. The cart belongs to a different store.","The customer can't be assigned to the cart. The cart belongs to a different store."
"The customer can't be assigned to the cart because the cart isn't anonymous.","The customer can't be assigned to the cart because the cart isn't anonymous."
"The customer can't be assigned to the cart because the customer already has an active cart.","The customer can't be assigned to the cart because the customer already has an active cart."
"A server error stopped your order from being placed. Please try to place your order again.","Um erro no servidor impediu que seu pedido fosse colocado. Por favor, tente fazer seu pedido novamente."
"The Cart includes virtual product(s) only, so a shipping address is not used.","The Cart includes virtual product(s) only, so a shipping address is not used."
"The shipping method can't be set. %1","The shipping method can't be set. %1"
"The shipping method can't be set for an empty cart. Add an item to cart and try again.","The shipping method can't be set for an empty cart. Add an item to cart and try again."
"Current customer does not have an active cart.","O cliente atual não tem um carrinho ativo."
