"Manage Shopping Cart","Manage Shopping Cart"
"Create Order","สร้างคำสั่งซื้อ"
"Back","ย้อนกลับ"
"Add Products","เพิ่มสินค้า"
"Update Items and Quantities","อัพเดทสินค้าและจำนวน"
"Are you sure you want to clear your cart?","คุณแน่ใจหรือไม่ว่าคุณต้องการลบสินค้าจากตะกร้า?"
"Clear my shopping cart","ล้างตะกร้า"
"Add selections to my cart","ใส่สินค้าที่เลือกในรถเข็นของฉัน"
"Cancel","ยกเลิก"
"Shopping Cart for %1 in %2","Shopping Cart for %1 in %2"
"Select products you want to buy","เลือกสินค้าที่คุณต้องการซื้อ"
"Product","สินค้า"
"Price","ราคา"
"Quantity","จำนวน"
"Products in the Comparison List (%1)","สินค้าในรายการเปรียบเทียบ (%1)"
"Last ordered items (%1)","สินค้าที่สั่งล่าสุด (%1)"
"Products","สินค้า"
"ID","ไอดี"
"SKU","รหัสสินค้า"
"Recently Compared Products (%1)","สินค้าที่เปรียบเทียบเมื่อเร็ว ๆ นี้ (%1)"
"Recently Viewed Products (%1)","สินค้าที่ดูเมื่อเร็ว ๆ นี้ (%1)"
"Add to Shopping Cart by SKU","เพิ่มลงรถเข็น โดย รหัสสินค้า"
"Add to Shopping Cart","เพิ่มลงตะกร้าสินค้า"
"Wish List (%1)","รายการที่ชอบ (%1)"
"Apply","นำไปใช้"
"Configure","ตั้งค่า"
"Add to Order by SKU","เพิ่มคำสั่งซื้อโดย รหัสสินค้า"
"Add to Order","เพิ่มคำสั่งซื้อ"
"Add Products to Order","เพิ่มสินค้าไปยังคำสั่งซื้อ"
"<span><span id=""sku-attention-num"">%1</span> product(s) require attention.</span>","<span><span id=""sku-attention-num"">%1</span> product(s) require attention.</span>"
"Remove All","เอาออกทั้งหมด"
"Only %1%2%3 left in stock","เหลือเพียง %1%2%3 ในคลังสินค้า"
"You can buy up to %1 of these per purchase.","คุณสามารถซื้อได้มากกว่า %1ชิ้น"
"You must buy at least %1 of these per purchase.","You must buy at least %1 of these per purchase."
"Specify the product's options.","Specify the product's options."
"Alert me when this item is available.","แจ้งเตือนเมื่อมีสินค้านี้"
"We can't find this customer.","We can't find this customer."
"Shopping cart management is disabled for this customer.","Shopping cart management is disabled for this customer."
"We can't find this store.","We can't find this store."
"Customers","ลูกค้า"
"Shopping Cart","ตระกร้าสินค้า"
"Sorry, something went wrong. You can find out more in the error log.","Sorry, something went wrong. You can find out more in the error log."
"You do not have access to this.","คุณไม่สามารถเข้าถึงบริการนี้"
"Ordered item id is not received.","Ordered item id is not received."
"Ordered item is not loaded.","Ordered item is not loaded."
"Quote item id is not received.","Quote item id is not received."
"Quote item is not loaded.","Quote item is not loaded."
"The wish list item id is not received.","The wish list item id is not received."
"The wish list item is not loaded.","The wish list item is not loaded."
"An error has occurred. See error log for details.","An error has occurred. See error log for details."
"You cannot configure a product.","ไม่สามารถปรับแต่งสินค้าได้"
"You removed the items.","คุณลบสินค้านี้แล้ว"
"You removed the item.","คุณลบสินค้านี้แล้ว"
"You added %1 to your shopping cart.","คุณเพิ่มสินค้า %1 ชิ้น ลงในตะกร้า"
"You cannot add a product.","คุณไม่สามารถ เพิ่มสินค้าได้"
"Order by SKU","เรียงตาม รหัสสินค้า"
"The SKU was not found in the catalog.","ไม่พบรหัสสินค้านี้ ในแค็ตตาล็อก"
"Availability: Out of stock.","สถานะ: สินค้าหมด"
"We don't have as many of these as you want.","We don't have as many of these as you want."
"You can't add this many to your cart.","You can't add this many to your cart."
"You need to choose options for your item.","คุณจำเป็นต้องเลือกตัวเลือก ของสินค้า"
"We can't add the item to your cart.","We can't add the item to your cart."
"Please enter an actual number in the ""Qty"" field.","โปรดระบุตัวเลขในช่อง ""จำนวน"""
"This product is assigned to another website.","This product is assigned to another website."
"You can add only enabled products.","You can add only enabled products."
"You cannot upload this file.","คุณไม่สามารถ อัพโหลดไฟล์นี้ได้"
"The file is empty.","The file is empty."
"You have not entered a product SKU. Please <a href=""%1"">click here</a> to add product(s) by SKU.","You have not entered a product SKU. Please <a href=""%1"">click here</a> to add product(s) by SKU."
"You have not entered a product SKU.","คุณไม่ได้ระบุ รหัสสินค้า"
"We can't add a product to cart by id ""%1"".","We can't add a product to cart by id ""%1""."
"Something went wrong while reordering this product.","Something went wrong while reordering this product."
"We can't find this wish list.","We can't find this wish list."
"You added %1 product to your shopping cart.","You added %1 product to your shopping cart."
"You added %1 products to your shopping cart.","You added %1 products to your shopping cart."
"%1 product requires your attention.","%1 product requires your attention."
"%1 products require your attention.","%1 products require your attention."
"Yes, for Specified Customer Groups","Yes, for Specified Customer Groups"
"Yes, for Everyone","Yes, for Everyone"
"No","ไม่"
"The file is corrupt.","The file is corrupt."
"Please upload the file in .csv format.","โปรดอัพโหลดไฟล์นามสกุล .csv"
"%1 item(s) need your attention.","%1 item(s) need your attention."
"Apply Coupon Code","ใช้รหัสคูปอง"
"Remove Coupon Code","ลบรหัสคูปอง"
"Remove","ลบ"
"The coupon code ""%1"" is not valid.","รหัสคูปอง ""%1"" ไม่สามารถใช้ได้"
"Shopping Cart Items","Shopping Cart Items"
"Qty","จำนวน"
"Subtotal","ผลรวมย่อย"
"Discount","ส่วนลด"
"Row Subtotal","Row Subtotal"
"Action","ดำเนินการ"
"No ordered items","No ordered items"
"Total %1 product(s)","Total %1 product(s)"
"Subtotal:","Subtotal:"
"Please select","กรุณาเลือก"
"Move to Wish List","ย้ายไปที่ รายการที่ชอบ"
"No item specified.","No item specified."
"Are you sure you want to remove this item?","Are you sure you want to remove this item?"
"SKU number","SKU number"
"Upload File","อัพโหลดไฟล์"
"Your csv file must include ""sku"" and ""qty"" columns.","ไฟล์ csv ของคุณต้องมีคอลัมน์ ""sku"" และ ""qty"""
"Reset","รีเซ็ต"
"SKU: ","รหัสสินค้า: "
"Only <span id=""%1_max_allowed"">%2</span> in stock","มีเพียง <span id=""%1_max_allowed"">%2</span> ในสต็อก"
"Item","รายการ"
"See price before order confirmation.","โปรดตรวจสอบราคาก่อนยืนยันการสั่งซื้อ"
"What's this?","นี่คืออะไร?"
"Incl. Tax","รวมภาษี"
"Excl. Tax","ไม่รวมภาษี"
"Edit item parameters","แก้ไข item parameters"
"Edit","แก้ไข"
"Remove item","ลบสินค้า"
"Products Requiring Attention","Products Requiring Attention"
"Add to Cart","เพิ่มในตะกร้าสินค้า"
"Sku","รหัสสินค้า"
"File","ไฟล์"
"File extensions allowed: .csv","ไฟล์ที่อนุญาต: .csv"
"Add Row","เพิ่มแถว"
"Remove Row","ลบแถว"
"Add Products By SKU","เพิ่มสินค้า ด้วย รหัสสินค้า"
"Shopping Cart Management","การจัดการ ตะกร้าสินค้า"
"View Shopping Cart","ดูตะกร้าสินค้า"
"View and modify Shopping Cart","ดูและปรับปรุงตะกร้าสินค้า"
"Order by SKU Settings","ตั้งค่า การจัดเรียงโดย รหัสสินค้า"
"Enable Order by SKU on My Account in Storefront","เปิดใช้งาน การสั่งซื้อด้วยรหัสสินค้า บน My Account ใน Storefront"
"Customer Groups","กลุ่มลูกค้า"
"Apply Coupon","ใช้รหัสคูปอง"
"Order by SKU Description","รายละเอียด การจัดเรียงโดย รหัสสินค้า"
"Display a Link to Loading a Spreadsheet","Display a Link to Loading a Spreadsheet"
"Defines whether a link to My Account &gt; Order by SKU page will be displayed on the widget","Defines whether a link to My Account &gt; Order by SKU page will be displayed on the widget"
"Link Text","ข้อความลิงก์"
"The text of the link to the My Account &gt; Order by SKU page","The text of the link to the My Account &gt; Order by SKU page"
"Load a list of SKUs","Load a list of SKUs"
"Order by SKU Template","เทมเพลต การจัดเรียงโดย รหัสสินค้า"
"SKU not found in catalog.","SKU not found in catalog."
"This file needs to be in .csv format.","This file needs to be in .csv format."
"This customer couldn't be found. Verify the customer and try again.","This customer couldn't be found. Verify the customer and try again."
"This store couldn't be found. Verify the store and try again.","This store couldn't be found. Verify the store and try again."
"An error occurred. For details, see the error log.","An error occurred. For details, see the error log."
"Orders can only be completed in an active store. Verify the store and try again.","Orders can only be completed in an active store. Verify the store and try again."
"The ordered item needs to be loaded. Load the item and try again.","The ordered item needs to be loaded. Load the item and try again."
"The quote item ID needs to be received. Set the ID and try again.","The quote item ID needs to be received. Set the ID and try again."
"The quote item needs to be loaded. Load the item and try again.","The quote item needs to be loaded. Load the item and try again."
"The wish list item ID needs to be received. Set the ID and try again.","The wish list item ID needs to be received. Set the ID and try again."
"The wish list item needs to be loaded. Load the item and try again.","The wish list item needs to be loaded. Load the item and try again."
"The file is corrupt and can't be used.","The file is corrupt and can't be used."
