"Product View Optimization","Otimização da Vista do Produto"
"Page View Optimization","Optimização da Vista de Página"
"Data key is missing: %1","A chave de dados em falta: %1"
"Google Analytics Content Experiments Code","Código de Experiências de Conteúdo Google Analytics"
"Experiment Code","Código da Experiência"
"Experiment code should be added to the original page only.","O código da experiência devia ser adicionado apenas à página original."
"Enable Content Experiments","Ativar Experiências de Conteúdo"
"Category View Optimization","Optimização da Vista de Categoria"
