"Gift Messages are not applicable for empty cart","Nie można skorzystać z wiadomości podarunkowych w przypadku pustego koszyka"
"Gift Messages are not applicable for virtual products","Nie można skorzystać z wiadomości podarunkowych w przypadku produktów wirtualnych"
"Gift Message is not available","Wiadomości podarunkowe nie są dostępne"
"Could not add gift message to shopping cart","Nie można było dodać wiadomości podarunkowej do koszyka"
"There is no item with provided id in the cart","W koszyku nie ma produktów z poprawnym identyfikatorem"
"There is no product with provided  itemId: %1 in the cart","Nie ma produktu z podanym id produktu: %1w koszyku"
"There is no item with provided id in the order","Nie ma produktu z podanym id w zamówieniu"
"There is no item with provided id in the order or gift message isn't allowed","Nie ma produktu z podanym id w zamówieniu lub wiadomość podarunkowa jest niedozwolona"
"Could not add gift message to order: ""%1""","Nie można było dodać wiadomości podarunkowej do zamówienia: %1"
"There is no order with provided id or gift message isn't allowed","Nie ma zamówień z podanym ID lub wiadomość podarunkowa nie jest dozwolona"
"There is no order with provided id","Nie ma zamówień z podanym ID"
"Gift Messages are not applicable for empty order","Wiadomości podarunkowe nie mają zastosowania do pustego zamówienia."
"Could not add gift message to order's item: ""%1""","Nie udało się dodać wiadomości prezentu dla przedmiotu: ""%1"""
"Unknown entity type","Nieznany rodzaj obiektu"
"Test label","Etykieta testowa"
"Use Config Settings","Używaj ustawienia z konfiguracji"
"From","Od"
"To","Do"
"Message","Wiadomość"
"Cancel","Anuluj"
"OK","OK"
"Gift Options","Opcje podarunkowe"
"Gift Message","Wiadomość prezentowa"
"Do you have any gift items in your order?","Czy twoje zamówienie zawiera prezenty?"
"Add Gift Options","Dodaj opcje podarunków"
"Gift Options for the Entire Order","Opcje prezentowe dla całego zamówienia"
"Leave this box blank if you don't want to leave a gift message for the entire order.","Pozostaw to pole puste jeżeli nie chcesz dodać wiadomości podarunkowej do całego zamówienia."
"Gift Options for Individual Items","Opcje podarunkowe dla pojedynczych produktów"
"<span>Item %1</span> of %2","<span>Produkt %1</span> %2"
"Leave a box blank if you don't want to add a gift message for that item.","Pozostaw to pole puste jeżeli nie chcesz dodać wiadomości podarunkowej dla produktu."
"Add Gift Options for the Entire Order","Dodaj opcje prezentowe dla całego zamówienia"
"You can leave this box blank if you don't want to add a gift message for this address.","Możesz pozostawić puste pole jeśli nie chcesz dodać wiadomości prezentowej dla tego adresu."
"Add Gift Options for Individual Items","Dodaj opcje podarunków dla poszczególnych przedmiotów"
"You can leave this box blank if you don't want to add a gift message for the item.","Możesz pozostawić puste pole jeśli nie chcesz dodać wiadomości prezentowej dla tego produktu."
"Gift Message (optional)","Wiadomość podarunkowa (opcjonalnie)"
"To:","Do:"
"From:","Z:"
"Message:","Wiadomość:"
"Update","Aktualizuj"
"Gift options","Opcje podarunkowe"
"Edit","Edytuj"
"Delete","Usuń"
"Allow Gift Messages on Order Level","Zezwól na wiadomość prezentową na poziomie zamówienia"
"Allow Gift Messages for Order Items","Zezwól na wiadomość prezentową dla produktów zamówienia"
"Gift Messages is not applicable for empty cart","Nie można skorzystać z wiadomości podarunkowych w przypadku pustego koszyka"
"Gift Messages is not applicable for virtual products","Nie można skorzystać z wiadomości podarunkowych w przypadku produktów wirtualnych"
"Gift Messages is not applicable for empty order","Wiadomości podarunkowe nie mają zastosowania do pustego zamówienia"
"Add gift options","Dodaj opcje prezentowe"
"Add gift options for Individual Items","Dodaj opcje podarunkowe dla pojedynczych produktów"
"Gift messages can't be used for an empty cart. Add an item and try again.","Gift messages can't be used for an empty cart. Add an item and try again."
"Gift messages can't be used for virtual products.","Gift messages can't be used for virtual products."
"The gift message isn't available.","The gift message isn't available."
"The gift message couldn't be added to Cart.","The gift message couldn't be added to Cart."
"No item with the provided ID was found in the Cart. Verify the ID and try again.","No item with the provided ID was found in the Cart. Verify the ID and try again."
"No product with the ""%1"" itemId exists in the Cart. Verify your information and try again.","No product with the ""%1"" itemId exists in the Cart. Verify your information and try again."
"No item with the provided ID was found in the Order. Verify the ID and try again.","No item with the provided ID was found in the Order. Verify the ID and try again."
"No item with the provided ID was found in the Order, or a gift message isn't allowed. Verify and try again.","No item with the provided ID was found in the Order, or a gift message isn't allowed. Verify and try again."
"The gift message couldn't be added to the ""%1"" order.","The gift message couldn't be added to the ""%1"" order."
"Either no order exists with this ID or gift message isn't allowed.","Either no order exists with this ID or gift message isn't allowed."
"No order exists with this ID. Verify your information and try again.","No order exists with this ID. Verify your information and try again."
"Gift messages can't be used for an empty order. Create an order, add an item, and try again.","Gift messages can't be used for an empty order. Create an order, add an item, and try again."
"The gift message couldn't be added to the ""%1"" order item.","The gift message couldn't be added to the ""%1"" order item."
