"Gift messages can't be used for an empty cart. Add an item and try again.","Mensagens de presente não podem ser usadas para um pedido vazio. Crie um pedido, adicione um item e tente novamente."
"Gift messages can't be used for virtual products.","Gift messages can't be used for virtual products."
"The gift message isn't available.","The gift message isn't available."
"The gift message couldn't be added to Cart.","The gift message couldn't be added to Cart."
"No item with the provided ID was found in the Cart. Verify the ID and try again.","No item with the provided ID was found in the Cart. Verify the ID and try again."
"No product with the ""%1"" itemId exists in the Cart. Verify your information and try again.","No product with the ""%1"" itemId exists in the Cart. Verify your information and try again."
"No item with the provided ID was found in the Order. Verify the ID and try again.","No item with the provided ID was found in the Order. Verify the ID and try again."
"No item with the provided ID was found in the Order, or a gift message isn't allowed. Verify and try again.","No item with the provided ID was found in the Order, or a gift message isn't allowed. Verify and try again."
"The gift message couldn't be added to the ""%1"" order.","The gift message couldn't be added to the ""%1"" order."
"Either no order exists with this ID or gift message isn't allowed.","Either no order exists with this ID or gift message isn't allowed."
"No order exists with this ID. Verify your information and try again.","No order exists with this ID. Verify your information and try again."
"Gift messages can't be used for an empty order. Create an order, add an item, and try again.","Gift messages can't be used for an empty order. Create an order, add an item, and try again."
"The gift message couldn't be added to the ""%1"" order item.","The gift message couldn't be added to the ""%1"" order item."
"Unknown entity type","Tipo de entidade desconhecida"
"Test label","Etiqueta de teste"
"Use Config Settings","Usar Configurações padrão"
"From","De"
"To","Até"
"Message","Mensagem"
"Cancel","Cancelar"
"OK","CONFIRMAR"
"Gift Options","Opções de presente"
"Gift Message","Mensagem do presente"
"Do you have any gift items in your order?","Você tem algum item de presente em seu pedido?"
"Add Gift Options","Adicionar Opções de Presente"
"Gift Options for the Entire Order","Opções de presente para o pedido inteiro"
"Leave this box blank if you don't want to leave a gift message for the entire order.","Deixe essa caixa em branco se você não quer deixar uma mensagem de presente para todo o pedido."
"Gift Options for Individual Items","Opções de presente para itens individuais"
"<span>Item %1</span> of %2","<span>Item %1</span> de %2"
"Leave a box blank if you don't want to add a gift message for that item.","Deixe a caixa vazia se você não quer adicionar uma mensagem de presente naquele item."
"Add Gift Options for the Entire Order","Adicionar opções de presente para o pedido inteiro"
"You can leave this box blank if you don't want to add a gift message for this address.","Você pode deixar esta caixa vazia se você não quer adicionar uma mensagem de presente para este endereço."
"Add Gift Options for Individual Items","Adicionar Opções de Presente para Itens Individuais"
"You can leave this box blank if you don't want to add a gift message for the item.","Você pode deixar esta caixa vazia se você não quer adicionar uma mensagem de presente para o item."
"Gift Message (optional)","Mensagem de Presente (opcional)"
"To:","Para:"
"From:","De:"
"Message:","Mensagem:"
"Update","Atualizar"
"Gift options","Opções de presente"
"Edit","Editar"
"Delete","Excluir"
"Allow Gift Messages on Order Level","Permitir Mensagens de Oferta ao Nível do pedido"
"Allow Gift Messages for Order Items","Permitir Mensagens de Oferta para Itens do Pedido"
