"Please specify a finance information website.","Proszę określić stronę informacji finansowej."
"Please specify a valid finance information website.","Proszę określić prawidłową stronę informacji finansowej."
"A row with this email, website, and finance website combination already exists.","Wiersz posiadający kombinację tego adresu e-mail, strony oraz strony finansowej już istnieje."
"Data was imported by %1","Dane zostały zaimportowane przez %1"
"Store Credit","Kredyt w sklepie"
"Reward Points","Punkty lojalnościowe"
