"Please specify a finance information website.","Por favor especifique um site de informação de finanças."
"Please specify a valid finance information website.","Por favor especifique um site de informação de finanças válido."
"A row with this email, website, and finance website combination already exists.","Já existe uma linha com a mesma combinação de email, site e site de finanças."
"Data was imported by %1","Os dados foram importados por %1"
"Store Credit","Crédito na Loja"
"Reward Points","Pontos de Recompensa"
