"The search failed because of a search engine misconfiguration.","La recherche a échoué en raison d’une mauvaise configuration du moteur de recherche."
"Elasticsearch Server Hostname","Nom du serveur hôte Elasticsearch"
"Elasticsearch Server Port","Port du serveur Elasticsearch"
"Elasticsearch Index Prefix","Préfixe d'index Elasticsearch"
"Enable Elasticsearch HTTP Auth","Activez l’authentification HTTP Elasticsearch"
"Elasticsearch HTTP Username","Nom d'utilisateur HTTP Elasticsearch"
"Elasticsearch HTTP Password","Mot de passe HTTP Elasticsearch"
"Elasticsearch Server Timeout","Délai d'expiration du serveur Elasticsearch"
"Test Connection","Tester la connexion"
