"The search failed because of a search engine misconfiguration.","The search failed because of a search engine misconfiguration."
"Elasticsearch Server Hostname","Hostname do Servidor Elasticsearch"
"Elasticsearch Server Port","Porto do Servidor Elasticsearch"
"Elasticsearch Index Prefix","Prefixo de Índice Elasticsearch"
"Enable Elasticsearch HTTP Auth","Ativar Autenticação HTTP para Elasticsearch"
"Elasticsearch HTTP Username","Username HTTP Elasticsearch"
"Elasticsearch HTTP Password","Palavra-passe HTTP Elasticsearch"
"Elasticsearch Server Timeout","Timeout do Servidor Elasticsearch"
"Test Connection","Testar Ligação"
