"Message has been rejected: %1","پیام رد شد:%1"
"MySQL Message Queue Cleanup","پاک کردن پیغام صف MySQL"
"All the times are in minutes. Use ""0"" if you want to skip automatic clearance.","همه زمان ها برحسب دقیقه هستند. اگر مایل به رد شدن از حذف خودکار هستید از «0» استفاده کنید."
"Retry Messages In Progress After","پیغام های در فرآیند را دوباره امتحان کن پس از"
"Successful Messages Lifetime","طول عمر پیغام های موفق"
"Failed Messages Lifetime","طول عمر پیغام های ناموفق"
"New Messages Lifetime","طول عمر پیغام های جدید"
"MySQL Message Queue Cleanup - all the times are in minutes. Use ""0"" if you want to skip automatic clearance","MySQL Message Queue Cleanup - all the times are in minutes. Use ""0"" if you want to skip automatic clearance"
