"Reward Points","Điểm thưởng"
"Reward Points History","Lịch sử điểm Phần thưởng"
"Expired reward","Phần thưởng đã hết hạn"
"Unlimited","Không giới hạn"
"No Data","Không có dữ liệu"
"Website","Trang web"
"Balance","Số dư"
"Currency Amount","Số tiền"
"Reward Points Threshold","Ngưỡng điểm thưởng"
"Reward Points Cap","Số mũ Điểm thưởng"
"Delete Orphan Points","Xóa điểm lẻ"
"Update Reward Points Balance","Cập nhật số dư điểm thưởng"
"Store","Cửa hàng"
"Update Points","Cập Nhật điểm"
"Enter a negative number to subtract from the balance.","Nhập một số âm để trừ từ số dư."
"Comment","Bình luận"
"Reward Points Notifications","Thông báo điểm thưởng"
"Subscribe for Balance Updates","Đăng ký để cập nhật số dư"
"Subscribe for Points Expiration Notifications","Đăng ký đển nhận thông báo các điểm hết hạn"
"Reward Exchange Rates","Tỷ giá chuyển đổi điểm thưởng"
"Add New Rate","Thêm mới các tỷ giá"
"Edit Reward Exchange Rate","Chỉnh sửa tỷ lệ chuyển đổi phần thưởng"
"New Reward Exchange Rate","Tỷ lệ chuyển đổi phần thưởng mới"
"Reward Exchange Rate Information","Thông tin tỷ lệ trao đổi Phần thưởng"
"Customer Group","Nhóm khách hàng"
"Direction","Hướng"
"Rate","Đánh giá"
"Use your reward points; %1 are available.","Sử dụng điểm thưởng của tôi; %1 có sẵn."
"Learn more","Tìm hiểu thêm"
"This applies only to registered users and may vary when a user is logged in.","Điều này chỉ áp dụng cho người dùng đăng ký và có thể thay đổi khi người dùng đăng nhập."
"You removed the orphan points.","Bạn loại bỏ các điểm bị bỏ rơi."
"Customers","Khách hàng"
"Manage Reward Exchange Rates","Quản lý các tỷ giá trao đổi phần thưởng"
"You deleted the rate.","Bạn đã xoá các tỷ lệ."
"You saved the rate.","Bạn đã lưu các tỷ lệ."
"We can't save this rate right now.","Chúng tôi không thể lưu tỷ lệ này ngay bây giờ."
"Please enter all rate information.","Vui lòng nhập tất cả các thông tin tỷ lệ."
"Please enter a positive integer number in the left rate field.","Vui lòng nhập số nguyên dương trong trường tỷ lệ bên trái."
"Please enter a positive number in the right-side rate field.","Vui lòng nhập một số dương trong trường tỷ lệ bên phải."
"Please enter a positive integer number in the right-side rate field.","Vui lòng nhập số nguyên dương trong trường tỷ lệ bên phải."
"Please enter a positive number in the left-side rate field.","Vui lòng nhập một số dương trong trường tỷ lệ bên trái."
"Sorry, but a rate for the same website, customer group and direction or covering rate already exists.","Xin lỗi, nhưng một tỷ lệ trên cùng một trang web, nhóm khách hàng và hướng hoặc tỷ lệ che phủ đã tồn tại."
"You removed the reward points from this order.","You removed the reward points from this order."
"Reward points will not be used in this order.","Reward points will not be used in this order."
"Page not found.","Không tìm thấy trang."
"You saved the settings.","Bạn lưu lại các thiết lập."
"You unsubscribed.","Bạn đã bỏ đăng ký theo dõi."
"You can't unsubscribed right now.","Bạn không thể hủy đăng ký ngay bây giờ."
"%1 Reward points (%2)","Điểm thưởng %1 (%2)"
"%1 Reward points","Điểm thưởng %1"
"Updated by moderator","Cập Nhật bởi người điều hành"
"Refunded from order #%1","Hoàn trả từ đơn đặt hàng #%1"
"Points voided at order #%1 refund.","Điểm bị để trống lúc đặt hàng #%1 hoàn trả."
"The invitation to %1 converted into a customer.","Lời mời đến %1 chuyển đổi thành một khách hàng."
"The invitation to %1 converted into an order.","Lời mời đến %1 chuyển đổi thành một đơn đặt hàng."
"Signed up for newsletter with email %1","Đăng ký nhận bản tin với email %1"
"Redeemed for order #%1","Chuộc cho đơn đặt hàng #%1"
"Earned points for order #%1","Kiếm được điểm cho đơn hàng #%1"
"Reverted from incomplete order #%1","Trở lại từ đơn đặt hàng không đầy đủ #%1"
"Registered as customer","Đăng ký là khách hàng"
"For submitting a product review","Để gửi một đánh giá sản phẩm"
"Earned promotion extra points from order #%1","Kiếm được điểm khuyến mãi từ đơn đặt hàng #%1"
"%1 store reward points available (%2)","%1 cửa hàng điểm thưởng có sẵn (%2)"
"%1 store reward points available","%1 điểm thưởng có sẵn"
"%1 was deducted because of refund.","%1 đã khấu trừ do hoàn lại tiền."
"The action ID you enter must be a number.","Thao tác ID bạn nhập vào phải là số."
"You don't have enough reward points to pay for this purchase.","Bạn không có đủ điểm thưởng để trả tiền cho việc mua hàng này."
"Points to Currency","Điểm đến tiền tệ"
"Currency to Points","Tiền tệ về điểm"
"All Customer Groups","Tất cả các nhóm khách hàng"
"Static","Tĩnh"
"Dynamic","Năng động"
"Each","Mỗi"
"First","Đầu tiên"
"All Websites","Tất cả trang Web"
"""Minimum Reward Points Balance"" should be either a positive number or left empty.","""Minimum Reward Points Balance"" should be either a positive number or left empty."
"""Cap Reward Points Balance"" should be either a positive number or left empty.","""Cap Reward Points Balance"" should be either a positive number or left empty."
"""Minimum Reward Points Balance"" should be less or equal to ""Cap Reward Points Balance"".","""Minimum Reward Points Balance"" should be less or equal to ""Cap Reward Points Balance""."
"Customer earned promotion extra %1.","Khách hàng được khuyến mãi thêm %1."
"The customer earned %1 for this order.","Khách hàng nhận được %1 cho đơn hàng này."
"Reward Points Balance","Số dư điểm thưởng"
"upper boundary","trên ranh giới"
"Refund Reward Points","Hoàn lại điểm thưởng"
"Reward Points refunded to customer","Điểm thưởng hoàn lại cho khách hàng"
"Remove","Loại bỏ"
"Back","Trở lại"
"Balance History","Lịch sử số dư"
"Amount","Số lượng"
"Points","Điểm"
"Reason","Lý do"
"Date","Ngày"
"Expires on %1","Hết hạn ngày %1"
"There is no balance history.","Không có lịch sử số dư."
"Reward points balance Information","Thông tin số dư điểm thưởng"
"Your balance is %1.","Số dư của bạn là %1."
"Current exchange rates:","Tỷ giá chuyển đổi hiện tại:"
"%1 = %2","%1 = %2"
"%1 spent = %2 earned","%1 dùng = %2 kiếm được"
"None","Không cái nào"
"Balance limit is %1.","Giới hạn số dư là %1."
"Maximum balance is reached","Đạt được số dư tối đa"
"Minimum Balance in order to redeem: %1.","Số dư tối thiểu để thanh toán: %1."
"You need a higher balance to use your rewards points.","Bạn cần số dư cao hơn để sử dụng điểm thưởng của bạn."
"Each earned reward points award expires in %1 days.","Mỗi điểm thưởng kiếm được hết hạn trong %1 ngày."
"Refer to reward points history to see when a specific record expires.","Tham khảo lịch sử điểm thưởng để xem khi nào bản ghi cụ thể hết hạn."
"Email Notification Settings","Cài đặt thông báo email"
"Save Subscription Settings","Lưu thiết đặt đăng ký"
"Reward Points Balance Updated at %store_name","Phần thưởng điểm cân bằng được Cập Nhật tại %store_name"
"%name,","%name,"
"You have %points_balance points that may be used in our store:","Bạn có %points_balance điểm mà có thể được sử dụng trong cửa hàng của chúng tôi:"
"<a href=""%unsubscription_url"">Unsubscribe</a> from these notifications.","<a href=""%unsubscription_url""> hủy bỏ đăng ký</a> từ những thông báo này."
"Reward Points Expiry Warning at %store_name","Phần thưởng điểm cảnh báo hết hạn tại %store_name"
"There are %remaining_days day(s) remaining to use %points_expiring of your reward points.","Có % remaining_days ngày còn lại để sử dụng %points_expiring của bạn điểm thưởng."
"After %remaining_days day(s) these points will expire.","Những điểm này sẽ hết hạn sau % remaining_days ngày."
"You have a total of %points_balance points that may be used in our store:","Bạn có tổng số điểm %points_balance có thể được sử dụng trong cửa hàng của chúng tôi:"
"Reward points","Điểm thưởng"
"Use reward points","Sử dụng điểm thưởng"
"Your reward point was successfully applied","Điểm thưởng của bạn được áp dụng thành công"
"Manage Reward Points Balances","Quản lý số dư điểm thưởng"
"Can Spend Reward Points","Có thể chi tiêu điểm thưởng"
"Enable Reward Points Functionality","Cho phép chức năng Điểm thưởng"
"Enable Reward Points Functionality on Storefront","Cho phép các chức năng Điểm thưởng trên Storefront"
"Customers May See Reward Points History","Khách có thể xem lịch sử điểm thưởng"
"Rewards Points Balance Redemption Threshold","Ngưỡng cứu chuộc số dư điểm thưởng"
"An empty value disables this limitation.","Một giá trị rỗng vô hiệu hoá hạn chế này."
"Cap Reward Points Balance At","Mũ số dư Điểm thưởng tại"
"Reward Points Expire in (days)","Phần thưởng điểm hết hạn (ngày)"
"Reward Points Expiry Calculation","điểm thưởng tính toán hết hạn"
"""Static"" defines the expiration date as precisely when the balance increases. ""Dynamic"" does not have an expiration date, but calculates one when the balance is checked for expiry.","""Tĩnh"" xác định ngày hết hạn chính xác là khi số dư tăng. ""Năng động"" không có ngày hết hạn, nhưng được tính khi số dư được kiểm tra nếu hết hạn."
"Refund Reward Points Automatically","Tự động Hoàn lại điểm thưởng"
"Deduct Reward Points from Refund Amount Automatically","Điểm thưởng từ số tiền hoàn trả khấu trừ tự động"
"Landing Page","Trang đích"
"Actions for Acquiring Reward Points by Customers","Các hành động để có được điểm thưởng của khách hàng"
"Purchase","Mua hàng"
"Added for spent money according to reward exchange rates.","Bổ sung đối với tiền đã qua sử dụng theo tỷ giá trao đổi phần thưởng."
"Registration","Đăng ký"
"Newsletter Signup","Đăng ký nhận bản tin"
"Only for customers who subscribe for the first time.","Chỉ dành cho những khách hàng đăng ký lần đầu tiên."
"Converting Invitation to Customer","Chuyển đổi các lời mời đến khách hàng"
"Invitation to Customer Conversions Quantity Limit","Lời mời để giới hạn số lượng chuyển đổi khách hàng"
"Converting Invitation to Order","Chuyển đổi các lời mời để đặt hàng"
"Invitation to Order Conversions Quantity Limit","Lời mời để giới hạn số lượng chuyển đổi đơn hàng"
"Invitation Conversion to Order Reward","Thư mời chuyển đổi cho thưởng điểm từ đơn hàng"
"Review Submission","Xem lại thông tin"
"After approval by administrator.","Sau khi phê duyệt bởi người quản trị."
"Rewarded Reviews Submission Quantity Limit","Giới hạn số lượng thưởng cho mỗi nhận xét được gửi"
"Email Sender","Người gửi Email"
"Subscribe Customers by Default","Đăng ký khách hàng theo mặc định"
"Balance Update Email","Thư điện tử Cập Nhật số dư"
"Reward Points Expiry Warning Email","Email cảnh báo hết hạn điểm thưởng"
"Expiry Warning Before (days)","Cảnh báo hết hạn trước khi (ngày)"
"Entering no value or a value greater than the expiration lifetime disables the warning notification.","Nhập một giá trị lớn hơn cả thời gian hết hạn hoặc không có giá trị vô hiệu hóa thông báo cảnh báo."
"Reward Points Rates","Tỷ giá điểm thưởng"
"Amount Balance","Số tiền dư"
"Created","Đã tạo"
"Expires","Hết hạn"
"ID","ID"
"Add Reward Points","Thêm điểm thưởng"
"Check out now and earn %1 for this order.","Thanh toán ngay bây giờ và có được %1 cho đơn hàng này."
"Create an account on our site now and earn %1.","Tạo một tài khoản trên trang web của chúng tôi ngay bây giờ và kiếm được %1."
"Subscribe to our newsletter now and earn %1.","Đăng ký nhận bản tin của chúng tôi và kiếm được %1."
"Send this invitation now and earn %s when your invitee signs up on our site.","Send this invitation now and earn %s when your invitee signs up on our site."
"You can reward up to %s invitee registration(s).","You can reward up to %s invitee registration(s)."
"Earn %s for purchases your invitees make.","Earn %s for purchases your invitees make."
"You can reward up to %s invitee purchase(s).","You can reward up to %s invitee purchase(s)."
"Submit a review now and earn %1 after the review is approved.","Gửi một đánh giá bây giờ và kiếm được %1 sau khi xem xét phê duyệt."
"You can reward up to %1 new reviews(s).","Bạn có thể được thưởng cho đến %1 đánh giá mới."
"Reward points should be a valid integer number.","Reward points should be a valid integer number."
"Send this invitation now and earn %1 when your invitee signs up on our site.","Send this invitation now and earn %1 when your invitee signs up on our site."
"You can reward up to %1 invitee registration(s).","You can reward up to %1 invitee registration(s)."
"Earn %1 for purchases your invitees make.","Earn %1 for purchases your invitees make."
"You can reward up to %1 invitee purchase(s).","You can reward up to %1 invitee purchase(s)."
"Sign in now and earn %1 for this order.","Sign in now and earn %1 for this order."
"The ""Minimum Reward Points Balance"" is invalid. The balance needs to be a positive number or left empty. Verify and try again.","The ""Minimum Reward Points Balance"" is invalid. The balance needs to be a positive number or left empty. Verify and try again."
"The ""Cap Reward Points Balance"" is invalid. The balance needs to be a positive number or left empty. Verify and try again.","The ""Cap Reward Points Balance"" is invalid. The balance needs to be a positive number or left empty. Verify and try again."
"The ""Minimum Reward Points Balance"" is invalid. The balance needs to be less than or equal to the ""Cap Reward Points Balance"".","The ""Minimum Reward Points Balance"" is invalid. The balance needs to be less than or equal to the ""Cap Reward Points Balance""."
