"Backup options","Alternativer for sikkerhetskopiering"
"Warning","Advarsel"
"Cancel","Avbryt"
"Ok","Ok"
"Insert Widget...","Insert Widget..."
"No records found.","Ingen oppføringer funnet."
"Recent items","Siste elementer"
"Show all...","Vis alle..."
"Please enter a number greater 0 in this field.","Skriv inn et tall større 0 i dette feltet."
"Please select one of each ratings above.","Velg en av hver av rangeringene ovenfor."
"Please specify Url.","Angi Url-adressen."
"Method %s does not exist on jQuery.decorate","Metoden %s finnes ikke på jQuery.decorate"
"Close","Lukk"
"Next","Neste"
"Previous","Forrige"
"Please wait...","Vennligst vent..."
"Loading...","Laster..."
"All ","All "
"more","mer"
"Save","Save"
"Translate","Oversett"
"Submit","Lagre"
"Please enter {0} words or less.","Skriv inn {0} ord eller mindre."
"Please enter at least {0} words.","Skriv inn minst {0} ord."
"Please enter between {0} and {1} words.","Angi mellom {0} og {1} ord."
"Letters or punctuation only please","Kun bokstaver eller tegnsetting tillatt"
"Letters, numbers, spaces or underscores only please","Kun bokstaver, tall, mellomrom og understreker er tillatt"
"Letters only please","Kun bokstaver"
"No white space please","Vennligst ingen mellomrom"
"Your ZIP-code must be in the range 902xx-xxxx to 905-xx-xxxx","Your ZIP-code must be in the range 902xx-xxxx to 905-xx-xxxx"
"A positive or negative non-decimal number please","Kun positivt eller negativt ikke-desimaltall tillatt"
"The specified vehicle identification number (VIN) is invalid.","Det angitte kjøretøy identifikasjonsnummeret (VIN) er ugyldig."
"Please enter a correct date","Skriv inn en riktig dato"
"Please enter a valid time, between 00:00 and 23:59","Skriv inn en gyldig tid, mellom 00:00 og 23:59"
"Please enter a valid time, between 00:00 am and 12:00 pm","Skriv inn en gyldig tid, mellom 00:00 og 12:00 pm"
"Please specify a valid phone number","Angi et gyldig telefonnummer"
"Please specify a valid mobile number","Angi et gyldig telefonnummer"
"Please enter at least {0} characters","Skriv inn minst {0} tegn"
"Please remove invalid characters: {0}.","Fjern ugyldige tegn: {0}."
"Please enter a valid credit card number.","Angi et gyldig kredittkortnummer."
"Please enter a valid IP v4 address.","Vennligst skriv inn en gyldig IP v4 adresse."
"Please enter a valid IP v6 address.","Skriv inn en gyldig IP v6 adresse."
"Invalid format.","Ugyldig format."
"HTML tags are not allowed.","HTML tags er ikke tillatt."
"Please select an option.","Velg et alternativ."
"Empty Value.","Tom verdi."
"Please use only letters (a-z or A-Z), numbers (0-9) or spaces only in this field.","Bruk bare bokstaver (a-z eller A-Z), tall (0-9) eller mellomrom i dette feltet."
"Please use only letters (a-z or A-Z), numbers (0-9) or underscore (_) in this field, and the first character should be a letter.","Bruk kun bokstaver (a-z eller A-Z), tall (0-9) eller understrek (_) i dette feltet. Det første tegnet må være en bokstav."
"Please use only letters (a-z or A-Z), numbers (0-9), spaces and ""#"" in this field.","Bruk bare bokstaver (a-z eller A-Z), tall (0-9), mellomrom eller ""#"" i dette feltet."
"Please enter a valid phone number. For example (123) 456-7890 or 123-456-7890.","Skriv inn et gyldig telefonnummer. For eksempel (123) 456-7890 eller 123-456-7890."
"Please enter a valid fax number (Ex: 123-456-7890).","Angi et gyldig faks nummer (for eksempel 123-456-7890)."
"Please enter a valid email address (Ex: johndoe@domain.com).","Angi en gyldig e-postadresse (for eksempel johndoe@domain.com)."
"Please enter 6 or more characters. Leading and trailing spaces will be ignored.","Angi 6 eller flere tegn. Overflødige mellomrom vil bli ignorert."
"Please enter 7 or more characters, using both numeric and alphabetic.","Angi 7 eller flere tegn, både numeriske og alfabetiske."
"Minimum length of this field must be equal or greater than %1 symbols. Leading and trailing spaces will be ignored.","Minimumslengde for dette feltet må være %1 symboler eller flere. Overflødige mellomrom vil bli ignorert."
"Minimum of different classes of characters in password is %1. Classes of characters: Lower Case, Upper Case, Digits, Special Characters.","Minimum forskjellige klasser av tegn i passord er %1. Klasser av tegn: små bokstaver, store bokstaver, sifre, spesialtegn."
"Please enter a valid URL. Protocol is required (http://, https:// or ftp://).","Oppgi en gyldig URL. Protokoll er nødvendig (http://, https:// or ftp://)."
"Please enter a valid URL. For example http://www.example.com or www.example.com.","Oppgi en gyldig URL. For eksempel http://www.example.com eller www.example.com."
"Please enter a valid XML-identifier (Ex: something_1, block5, id-4).","Oppgi en gyldig XML-identifier (for eksempel something_1, block5, id-4)."
"Please enter a valid social security number (Ex: 123-45-6789).","Angi et gyldig personnummer (for eksempel 05099050898)."
"Please enter a valid zip code (Ex: 90602 or 90602-1234).","Venligst angi en gyldig postkode (F. eks. 6088)."
"Please use this date format: dd/mm/yyyy. For example 17/03/2006 for the 17th of March, 2006.","Bruk dette formatet for dato: dd/mm/åååå. For eksempel 17/03/2006 for 17. Mars, 2006."
"Please enter a valid $ amount. For example $100.00.","Please enter a valid $ amount. For example $100.00."
"Please enter a number 0 or greater in this field.","Angi et nummer 0 eller større i dette feltet."
"Please enter a number greater than 0 in this field.","Skriv inn et tall større enn 0 i dette feltet."
"Please input a valid CSS-length (Ex: 100px, 77pt, 20em, .5ex or 50%).","Please input a valid CSS-length (Ex: 100px, 77pt, 20em, .5ex or 50%)."
"Please enter a valid number in this field.","Vennligst skriv inn et gyldig tall i dette feltet."
"The value is not within the specified range.","Verdien er ikke innenfor det angitte området."
"Please use letters only (a-z or A-Z) in this field.","Vennligst bruk bare bokstaver ( a-å eller A-Å) i dette feltet."
"Please use only letters (a-z), numbers (0-9) or underscore (_) in this field, and the first character should be a letter.","Please use only letters (a-z), numbers (0-9) or underscore (_) in this field, and the first character should be a letter."
"Please use only letters (a-z or A-Z) or numbers (0-9) in this field. No spaces or other characters are allowed.","Bruk bare bokstaver (a-z eller A-Z) eller tall (0-9) i dette feltet. Ingen mellomrom eller andre tegn er tillatt."
"Please enter a valid date.","Vennligst angi en gyldig dato."
"Make sure the To Date is later than or the same as the From Date.","Kontroller at Til Dato er senere enn eller samme som Fra Dato."
"Please make sure your passwords match.","Kontroller at passordene er like."
"Please enter a valid URL Key (Ex: ""example-page"", ""example-page.html"" or ""anotherlevel/example-page"").","Please enter a valid URL Key (Ex: ""example-page"", ""example-page.html"" or ""anotherlevel/example-page"")."
"Please enter a valid zip code.","Vennligst skriv inn en gyldig zip-kode."
"Please select one of the options above.","Vennligst velg ett av alternativene ovenfor."
"Please select State/Province.","Vennligst angi Stat/Province."
"Please select a file.","Vennligst velg en fil."
"The field isn't complete.","Dette feltet er ikke komplett."
"This is a required field.","Dette er et obligatorisk felt."
"Please select one of the options.","Vennligst velg ett av alternativene."
"Please enter a value less than or equal to %s.","Skriv inn en verdi som er mindre enn eller lik %s."
"Please enter a value greater than or equal to %s.","Skriv inn en verdi større enn eller lik %s."
"Please enter valid email addresses, separated by commas. For example, johndoe@domain.com, johnsmith@domain.com.","Angi gyldige e-postadresser, atskilt med komma. For eksempel johndoe@domain.com, johnsmith@domain.com."
"Card type does not match credit card number.","Korttypen samsvarer ikke med kredittkortnummer."
"Credit card number does not match credit card type.","Kredittkortnummeret samsvarer ikke med type kredittkort."
"Incorrect credit card expiration date.","Ugyldig utløpsdato for kredittkortet."
"Please enter a valid credit card verification number.","Please enter a valid credit card verification number."
"Please enter issue number or start date for switch/solo card type.","Please enter issue number or start date for switch/solo card type."
"Please enter less or equal than %1 symbols.","Please enter less or equal than %1 symbols."
"Please enter more or equal than %1 symbols.","Please enter more or equal than %1 symbols."
"Please enter positive number in this field.","Please enter positive number in this field."
"Please enter a valid value, ex: 10,20,30","Please enter a valid value, ex: 10,20,30"
"Please enter a valid value from list","Please enter a valid value from list"
"Please enter valid SKU key.","Vennligst angi en gyldig SKU nøkkel."
"Please enter a valid number.","Vennligst skriv inn et gyldig tall."
"This is required field","Dette er et obligatorisk felt"
"Admin is a required field in each row.","Admin is a required field in each row."
"Password cannot be the same as email address.","Password cannot be the same as email address."
"Please fix this field.","Vennligst fyll inn dette feltet."
"Please enter a valid email address.","Vennligst skriv inn en gyldig e-postadresse."
"Please enter a valid URL.","Vennligst skriv inn en gyldig URL."
"Please enter a valid date (ISO).","Vennligst angi en gyldig dato(ISO)."
"Please enter only digits.","Oppgi kun tall."
"Please enter the same value again.","Vennligst oppgi samme verdi igjen."
"Please enter no more than {0} characters.","Skriv inn minst {0} tegn."
"Please enter at least {0} characters.","Skriv inn minst {0} tegn."
"Please enter a value between {0} and {1} characters long.","Angi en verdi mellom {0} og {1}."
"Please enter a value between {0} and {1}.","Angi en verdi mellom {0} og {1}."
"Please enter a value less than or equal to {0}.","Skriv inn en verdi som er mindre enn eller lik {0}."
"Please enter a value greater than or equal to {0}.","Skriv inn en verdi større enn eller lik {0}."
"Please specify the quantity of product(s).","Vennligst spesifiser antall produkt(er)."
"Please enter a date between %min and %max.","Angi en dato mellom % min og % maks."
"Please enter a valid full date.","Angi en gyldig dato."
"Please enter a valid month (1-12).","Angi en gyldig måned (1-12)."
"Please enter a valid year (1900-%1).","Angi et gyldig år (1900-%1)."
"Please enter a valid day (1-%1).","Angi en gyldig dag (1-%1)."
"Please enter a date from the past.","Angi en dato fra fortiden."
"Maximum length of this field must be equal or less than %1 symbols.","Maximum length of this field must be equal or less than %1 symbols."
"Admin is a required field in the each row.","Admin is a required field in the each row."
"Please enter a quantity greater than 0.","Please enter a quantity greater than 0."
"The fewest you may purchase is %1.","The fewest you may purchase is %1."
"The maximum you may purchase is %1.","The maximum you may purchase is %1."
"You can buy this product only in quantities of %1 at a time.","Du kan kjøpe dette produktet kun i mengder %1 om gangen."
"Forbidden extensions has been used. Avoid usage of ","Forbidden extensions has been used. Avoid usage of "
"No marginal white space please","Vennligst ingen mellomrom"
"Please enter 6 or more characters. Leading or trailing spaces will be ignored.","Please enter 6 or more characters. Leading or trailing spaces will be ignored."
"Enter valid SKU key","Enter valid SKU key"
"Swatch and Admin are the required fields in the each row.","Swatch and Admin are the required fields in the each row."
"Insert Variable","Insert Variable"
"Insert Widget","Insert Widget"
"The widget %1 is no longer available. Select a different widget.","The widget %1 is no longer available. Select a different widget."
"First character must be letter.","Første tegn må være en bokstav."
"The password can't be the same as the email address. Create a new password and try again.","Passordet kan ikke være det samme som e-postadressen. Opprett et nytt passord, og prøv på nytt."
